{
  "id": "licence_cc_by_4_0",
  "name": "Creative Commons Attribution 4.0 International",
  "expression": "CC-BY-4.0",
  "referenceLocator": "https://creativecommons.org/licenses/by/4.0/",
  "commercialUse": "allowed",
  "attributionRequired": true,
  "requiredNotice": "Attribution required by the source licence."
}
